{
  "schema_id": "compiler.scene-plan.v2",
  "compiler_version": "compiler.scene-execution.v2",
  "source": {
    "novel_plan_hash": "f5cac25506fc7abbc0eea55d70f779be955318ff87df31921b175f0753a18662",
    "narrative_ir_hash": "3ae56a41e597941588f4d2fb43bad8a5bb8d3328eb6671b6df15ddbb868bf9a2",
    "scene_compiler_input_hash": "2e5eba0572e2db0cfdb1193e2410e04cbf229cb39db54e4886b361185cf36eb0",
    "semantic_fill_hash": "01287a0fdea75f3e9d167d655f3546d81e08cb34cf7abacf8f559fa1a28db681",
    "component_fingerprint": "fda9a85a687c83338f61e0a303b53d317f3b4f34562f2cec24222c067a095805"
  },
  "chapters": [
    {
      "chapter_id": "chapter_1",
      "ordinal": 1,
      "act_ordinal": 1,
      "title": "第1章",
      "scene_ids": [
        "scene_1",
        "scene_2",
        "scene_3"
      ]
    }
  ],
  "scenes": [
    {
      "scene_id": "scene_1",
      "chapter_id": "chapter_1",
      "discourse_order": 1,
      "purpose": "hook",
      "presentation_mode": "linear",
      "objective": "推进 flashback_chronology 的 basic 场景 1。",
      "dramatic_goal": "落实 scene_1 的既定目标。",
      "conflict": "来源事实与角色目标形成可执行阻力。",
      "outcome": "硬义务完成并为后续场景留下可追溯状态。",
      "pov_ref": {
        "object_type": "entity",
        "object_id": "ent_researcher"
      },
      "participant_refs": [
        {
          "object_type": "entity",
          "object_id": "ent_researcher"
        },
        {
          "object_type": "entity",
          "object_id": "ent_backup_system"
        }
      ],
      "location_ref": {
        "object_type": "location",
        "object_id": "loc_lab"
      },
      "story_time_refs": [
        {
          "object_type": "event",
          "object_id": "evt_restart_seven"
        }
      ],
      "audience_state_before": [],
      "audience_state_after": [
        {
          "entry_key": "exposure_manual_trace",
          "status": "introduced",
          "first_scene_id": "scene_1",
          "last_scene_id": "scene_1"
        }
      ],
      "allowed_reveals": [
        {
          "entry_key": "exposure_manual_trace",
          "action": "introduce"
        }
      ],
      "forbidden_reveal_entry_keys": [
        "exposure_restart_log"
      ],
      "resolution_actions": [],
      "prerequisite_scene_ids": [],
      "beat_ids": [
        "beat_scene_1_001",
        "beat_scene_1_002"
      ],
      "state_before_hash": "d4d9889077ca7b8f97c439934bf6adef9e28209f88a47c872d12eb99b60e7666",
      "state_after_hash": "490deb25df21df2cd82b610e997f0d6e1ef316bf011a62cc6393c47a86d1e426",
      "source_refs": [
        {
          "object_ref": {
            "object_type": "claim",
            "object_id": "claim_manual_trigger"
          },
          "field_path": "",
          "source_fragment_hash": "9adc1888f69651041a2ab6e6820065211a744d9948ea3dad1cf19cf79cbb8fd4"
        },
        {
          "object_ref": {
            "object_type": "event",
            "object_id": "evt_restart_seven"
          },
          "field_path": "",
          "source_fragment_hash": "db77c929c0a560efabf9993eb982e84425faec114632547597c52ffa3382a707"
        },
        {
          "object_ref": {
            "object_type": "information_unit",
            "object_id": "info_manual_trace"
          },
          "field_path": "",
          "source_fragment_hash": "dca993063b5c935f909be90f7085854579f900b9160e697c56ae26e95daddb37"
        }
      ]
    },
    {
      "scene_id": "scene_2",
      "chapter_id": "chapter_1",
      "discourse_order": 2,
      "purpose": "reveal",
      "presentation_mode": "flashback",
      "objective": "推进 flashback_chronology 的 basic 场景 2。",
      "dramatic_goal": "落实 scene_2 的既定目标。",
      "conflict": "来源事实与角色目标形成可执行阻力。",
      "outcome": "硬义务完成并为后续场景留下可追溯状态。",
      "pov_ref": {
        "object_type": "entity",
        "object_id": "ent_researcher"
      },
      "participant_refs": [
        {
          "object_type": "entity",
          "object_id": "ent_researcher"
        },
        {
          "object_type": "entity",
          "object_id": "ent_backup_system"
        }
      ],
      "location_ref": {
        "object_type": "location",
        "object_id": "loc_lab"
      },
      "story_time_refs": [
        {
          "object_type": "event",
          "object_id": "evt_restart_six"
        }
      ],
      "audience_state_before": [
        {
          "entry_key": "exposure_manual_trace",
          "status": "introduced",
          "first_scene_id": "scene_1",
          "last_scene_id": "scene_1"
        }
      ],
      "audience_state_after": [
        {
          "entry_key": "exposure_manual_trace",
          "status": "introduced",
          "first_scene_id": "scene_1",
          "last_scene_id": "scene_1"
        },
        {
          "entry_key": "exposure_restart_log",
          "status": "introduced",
          "first_scene_id": "scene_2",
          "last_scene_id": "scene_2"
        }
      ],
      "allowed_reveals": [
        {
          "entry_key": "exposure_restart_log",
          "action": "introduce"
        }
      ],
      "forbidden_reveal_entry_keys": [],
      "resolution_actions": [],
      "prerequisite_scene_ids": [
        "scene_1"
      ],
      "beat_ids": [
        "beat_scene_2_001",
        "beat_scene_2_002"
      ],
      "state_before_hash": "490deb25df21df2cd82b610e997f0d6e1ef316bf011a62cc6393c47a86d1e426",
      "state_after_hash": "b7b4672e25849e057845557db85e86b35bd437e0e7d1c9cf81d4c85be264a560",
      "source_refs": [
        {
          "object_ref": {
            "object_type": "claim",
            "object_id": "claim_backup_trigger"
          },
          "field_path": "",
          "source_fragment_hash": "91da5febae81c62038200b22ba254a4dc856d5127a57616db8c1612bcee767e7"
        },
        {
          "object_ref": {
            "object_type": "event",
            "object_id": "evt_restart_six"
          },
          "field_path": "",
          "source_fragment_hash": "b84e3316b5791cf929a81196e415a172a6b5737d90c082a84c2376197393d4b2"
        },
        {
          "object_ref": {
            "object_type": "information_unit",
            "object_id": "info_restart_log"
          },
          "field_path": "",
          "source_fragment_hash": "459f50c195487b3d63f92d7deb8043cc176c161e6202e57c424f9dbeb891b8b7"
        }
      ]
    },
    {
      "scene_id": "scene_3",
      "chapter_id": "chapter_1",
      "discourse_order": 3,
      "purpose": "resolution",
      "presentation_mode": "linear",
      "objective": "推进 flashback_chronology 的 basic 场景 3。",
      "dramatic_goal": "落实 scene_3 的既定目标。",
      "conflict": "来源事实与角色目标形成可执行阻力。",
      "outcome": "硬义务完成并为后续场景留下可追溯状态。",
      "pov_ref": {
        "object_type": "entity",
        "object_id": "ent_researcher"
      },
      "participant_refs": [
        {
          "object_type": "entity",
          "object_id": "ent_researcher"
        },
        {
          "object_type": "entity",
          "object_id": "ent_backup_system"
        }
      ],
      "location_ref": {
        "object_type": "location",
        "object_id": "loc_lab"
      },
      "story_time_refs": [
        {
          "object_type": "event",
          "object_id": "evt_restart_seven"
        }
      ],
      "audience_state_before": [
        {
          "entry_key": "exposure_manual_trace",
          "status": "introduced",
          "first_scene_id": "scene_1",
          "last_scene_id": "scene_1"
        },
        {
          "entry_key": "exposure_restart_log",
          "status": "introduced",
          "first_scene_id": "scene_2",
          "last_scene_id": "scene_2"
        }
      ],
      "audience_state_after": [
        {
          "entry_key": "exposure_manual_trace",
          "status": "introduced",
          "first_scene_id": "scene_1",
          "last_scene_id": "scene_1"
        },
        {
          "entry_key": "exposure_restart_log",
          "status": "introduced",
          "first_scene_id": "scene_2",
          "last_scene_id": "scene_2"
        }
      ],
      "allowed_reveals": [],
      "forbidden_reveal_entry_keys": [],
      "resolution_actions": [
        {
          "resolution_ref": {
            "object_type": "resolution_spec",
            "object_id": "res_root_cause"
          },
          "action": "resolve"
        },
        {
          "resolution_ref": {
            "object_type": "resolution_spec",
            "object_id": "res_shutdown_rule"
          },
          "action": "resolve"
        }
      ],
      "prerequisite_scene_ids": [
        "scene_2"
      ],
      "beat_ids": [
        "beat_scene_3_001",
        "beat_scene_3_002",
        "beat_scene_3_003"
      ],
      "state_before_hash": "b7b4672e25849e057845557db85e86b35bd437e0e7d1c9cf81d4c85be264a560",
      "state_after_hash": "b7b4672e25849e057845557db85e86b35bd437e0e7d1c9cf81d4c85be264a560",
      "source_refs": [
        {
          "object_ref": {
            "object_type": "event",
            "object_id": "evt_restart_seven"
          },
          "field_path": "",
          "source_fragment_hash": "db77c929c0a560efabf9993eb982e84425faec114632547597c52ffa3382a707"
        },
        {
          "object_ref": {
            "object_type": "hypothesis",
            "object_id": "hyp_automatic_restart"
          },
          "field_path": "",
          "source_fragment_hash": "27312587f803744595e0eb4db9d5f8059465669e75e34803371ededa0bf88cdd"
        },
        {
          "object_ref": {
            "object_type": "hypothesis",
            "object_id": "hyp_manual_restart"
          },
          "field_path": "",
          "source_fragment_hash": "bc7fcad806a9aae3e34b1456080bcb166f100b03fbcee9b70051ec93fb1bf990"
        },
        {
          "object_ref": {
            "object_type": "resolution_spec",
            "object_id": "res_root_cause"
          },
          "field_path": "",
          "source_fragment_hash": "557ef621b39947efdf13d38ff8b0b1ec16dec3d665c7bd4d3f5b2d055113e69b"
        },
        {